,Tweet,Class
4198,اكسبو دبي  مكتسبات ونجاحات لدولة الامارات تجسدت المكتسبات المحقة النجاح تنظيم معرض اكسبو دبي نوعية الاتفاقيات  الشراكات العالمية توقيعها الشركات الاماراتية ونظيرتها الاجنبية  والانتعاش الاقتصادي عرفه القطاع السياحي,positive
3492,تشرفت بالعمل معهم جناح دول مجلس التعاون ذكرا بنساها لابد انا الي كنت اقول مستحيل اداوم مكان ام القيوين عشان انش وقت اكسبو خلاني يوميا انش الفجر اسير ارد شعور غريب حبيته عقب ماتعودت   ,positive
3958,وداعا اكسبو  كنت جميلا   اكسبو,positive
1730, بتكون احلا حفله     ,positive
4243,الجناح اليمني يفوز بالجاءزة الذهبية اكسبو دبي الجمعة ابريل  عدن المستقبل نال الجناح اليمني الجاءزة الذهبية باكسبو دبي واحرزت اليمن الجاءزة الذهبية كافضل تطوير موضوع ومحتوا لجناح تاريخ اكسبو وحمل الجناح اليمني ترعاه ذهبيا مجموعة شركات هاءل سعيد انعم ,positive
2465,المنشور مخص لجميع النساء العالم نتمنا تحق احلامك وتستمرين الهام الاخرين بالكلمات والافعال اسراءيل اسراءيل اكسبو اسراءيل اكسبو  دبي اكسبو دبي  العالمي اكسبو  دبي الجناح الاسراءيلي هذه اسراءيل ,positive
3551,اجواء ضبابية ساحرة غلبت مشاعر الفخر والحزن اغلقت معالي ريم بنت ابراهيم الهاشمي بوابة  تمام الساعة الـ لتعلن بذلك انتهاء اروع واجمل نسخة لمعرض اكسبو التاريخ وبشهادة المشاركين شكرا لكل ساهم نجاح الحدث الحمدله علا التوفيق والنجاح  ,positive
3344,ختام اكسبو دبي شكرا علا متابعتكم لقنوات ابوظبي لاعلام ومنصاتها الرقمية  هنا العالم مساء اكسبو,positive
1672,  الدكتور بدر المشعان مثال لمواطن الكويتي يشرف دولته المحافل الدولية معرفته كنز غريبه علا ابناء الكويت الكرم والضيافة نفتخر بينا اكسبو  دبي  ,positive
2834,شاركت العديد الجامعات والكليات دولة الامارات والعالم  اكسبو  دبي  ملامح التحول التعليم  لتكون مخرجاته مرتبطة مباشرة بالمستقبل المهني الوظيفي لطلبة علوم الدار ,positive
278,زرت بالأمس جناح السعودية اكسبو دبي جميل جدا ويستحق الاقبال الكبير طريقتهم تخفيف طوابير الدخول ذكية,positive
952,شغلهم اكسبو دبي ممتاز عديل والله,positive
2714,   اكسبو  دبي اسبوع القمة العالمية لحكومات وموسم الاجازات يقفزان باعداد الزيارات الذروة اكسبو   ,positive
1945,صوت الاصالة ميحد حمد اكسبو ,positive
2651,ليبيريا اغنية والوحدة تحتفل بيومها الوطني اكسبو         اكسبودبي البيان القارء داءما,positive
1491, اكسبو اكتسب سمعة استثناءية بكونه وجهة ميزه لتذوق الذ النكهات العالمية  لذا فانه يدعو الزوار الراغبين تجربة امور عادية  لمشاركة الرحلة  والانتقاء العروض الميزة عالم فنون الطهي يقدمها الحدث الدولي عينك علا اكسبو  ,positive
4107,الامارات اثبت لعالم نجاحها اكسبو  دبي وساعدت علا تنمية اقتصادات الدول,positive
3101, شكرك يوحي انك المنظم لهذا الحدث انت تشكر ساهمت المنظمين,positive
2091, استلمت الجواز الجميل ابيض الون اصدار محدود ختم  دولة الجواز العادي شكرا جزيلا اكسبو  ,positive
4219, عمل  دولة اكسبو انتها عزيمة اخوتنا دولة الامارات لاتنتهي        بارك اله وبجهودكم اكسبو  دبي,positive
2379,الخير هنا    اكسبو ,positive
2022,اكسبو  دبي زيمبابوي تكشف وجها السياحي المذهل,positive
2823,خليفة بن طحنون يشارك ابناء الشهداء وذويهم مبادرة رحلة وطن تضمنت افتاح بوابة اكسبو دبي  وزيارة متحف المستقبل,positive
155,الامارات قدمت للعالم فرصة ذهبية لاستقطاب المبدعين أنحاء العالم معرض اكسبو دبي أنعش مجال السياحة جناح السودان ,positive
2312,  فديت عيونج,positive
985,جناح مجلس التعاون إكسبو دبي استضاف ورشة عمل جائزة أفضل مكتب خدمات مشتركي الكهرباء والماء بتنظيم قطاع الشؤون الاقتصادية والتنموية,positive
4055,دورية السعادة تنشر الايجابية جمهور اكسبو  دبي وبرج خليفة ومتحف المستقبل,positive
1614, انتظروني جايكم اعيش التجربة الفريدة باذن اله تعالا منتصف الشهر الحالي    ,positive
3033,اكسبو  دبي يسجل   افتاح الحدث اكتوبر وحتا الجاري  وتجاوزت اعداد الزيارات الافتراضية عبر المنصات الرقمية  تونس العربي فخر الامارات اكسبو  ,positive
981,ترى عادي بلدين ناجحين جنب بعضهم شوية ثقة وش اللي بساط كأننا بكشته؟ وترى السعودين رواد دبي نفسهم السعودين بموسم رياضهم ومنهم محمد عبده اللي غنى اكسبو دبي نقول ونطول بإذن الله زي نرفع مكان نرتاده بقعة بالعالم نعجز نوصل بوطننا لعنان السماء,positive
2226,سعدت جدا بلقاء والسلام علا سمو الشيخ عبداله زايد وزير الخارجية والتعاون الدولي اثناء زيارته لمعرض اكسبو  المراة العالمي     ,positive
1714, شكرا علي حضورك شكرا علي تواضعك شكرا علي ابداعك بجد اسعادتنا,positive
3683,اشهر الجهد والمثابرة والابداع قدمنا لعالم نسخة تكر الشعب شارك انجاح الحدث بمختلف الشراءح شكرا لجميع وشكرا لكل الجنود المجهولين  ,positive
4367,اكسبو  دبي نموذج ملهم يلخص قصة نجاح دولة الامارات ,positive
2432,اكدت الشيخة ميثاء بنت احمد مبارك معرض اكسبو  دبي يمثل فصلا استثناءيا  وانجازا عالميا يضاف لمسيرة نجاحات دولة الامارات  معرض مهم ثقله المحافل الدولية ,positive
2369,ام علي طبق تحلو الماءدة العربية لذة طعمه يزال محافظا علا نكهته التقليدية اضيفت المكملات       اكسبودبي اكسبو     البيان القارء داءما,positive
4285,ابحث داءما روح الاشياء شكلها  اكسبو  دبي اكسبلور   ,positive
2240, يسوا ميحد,positive
4123, عد الزوار استقطب جناح المغرب ختام معرض اكسبو دبي  الاف شخصية رفيعة المستوا مختلف دول العالم  المغرب,positive
3221, احبهم وايد ويارب يردون     ,positive
1457,الاحلام حقيقة اكسبو دبي تفاصيل السيارة الاجرة الطاءرة عينك علا اكسبو   ,positive
1395,كلمة حق تنقال لرجال شرطة دبي اكسبو موقف بسيط الزحمة نشوف رجال شرطة دبي فازعين يساعدون بدون يطلبهم,positive
4025,رءيس الامن السيبراني اكسبو  دبي نموذج ملهم الابداع الانساني ,positive
1499,ويواصل الحدث العالمي نجاحه جذب الزوار مختلف الجنسيات والاعمار لاستمتاع بفعالياته وعروضه الترفيهية المتنوعة اكسبو  دبي اكسبو  ,positive
700,القيادات الاماراتية الرشيدة نجحت إقامة اكسبو دبي حدث تاريخي شهده العالم بأسره فقد بذلت الجهود لتقديمه بأفضل صورة التنظيم التصميم والإدارةقلب ,positive
2634,مبروك لمهندس عادل الوصيص حصوله المركز علا مستوا الخليج العربي لجاءزة مكتب براءات الاختراع لدعم الابتكار والاختراع مسابقة افضل مشروع لتقنية المياه معالجتها دول مجلس التعاون          مبروك                   ,positive
644,فديتنا تعال اكسبو وايد حلو,positive
1965,دعني معك ربوع اكسبو دبي نتجول واعطيك عمري علا رجعتكم هدية اكسبو دبي  الزيارة رقم ,positive
2860,الامارات ارض الخير شهدت اقبال جماهيري علا اكسبو  دبي كافة انحاء العالم        ,positive
929,رحت معرض كازاخستان اكسبو دبي وفعلا الخيول الطبيعة عندهم تجنننن معرضهم دبي مستمد,positive
2213,انا ماتم حد فالدولة خطت اسير وياه القرية اكسبو مهرجان زايد نحوط دبي انا طاقتي شغفي بالعافية يودوني الجيم الي حرفيا ربع ساعة بيتنا اعتذر لجميع الي رسمت خط معاهم ,positive
4046,دورية السعادة تنشر الايجابية جمهور اكسبو  دبي وبرج خليفة ومتحف المستقبل  الكفاح نيوز زهير الغزال الاحساء,positive
3439,تعودنا داءما حضورنا ميز دبي حضرنا لحصد كافة جواءز التميز      رءية السعودية  الملكة العربية السعودية ,positive
246,جميل اكسبو دبيوجه_مبتسم_بعيون_قلب ,positive
2602,ختام اسطوري الانتظار   اكسبودبي البيان القارء داءما,positive
923,رحت إكسبو دبي انهاردة العصر دخلت السعودية السويد أمريكا سويسرا إيطاليا ال ألطف,positive
3540,ختام اكسبو  دبي اقول شكرا لجميع المنظمين والعاملين علا الانجاز العظيم والراءع والجميل ابهر العالم وابارك لحكومتنا الرشيدة علا الانجاز العالي والراءع شاء اله الامارات نجاح نجاح شكرا  وداعا اكسبو,positive
1185,زرت اكسبو ذهلت التنظيم والنظافة والرقي التعامل الزوار فهل الجنين ولد رحم الصحراء وكبر وتتطور وارتقى مجاملة تملقا؛ أدمعت عيني فرحا وزهوا فكم الجهود بذلت وكم العقول ساهمت بناء الصرح المذهل اجلالا نقف,positive
268,اميتاب باتشان الاسطوري وإعلان جميل ورائع اكسبو دبي,positive
669,تجربه رائعه اكسبو دبي ثقافات جميله وتنظيم رائع اكتر معرض عجبني الانجولي معرض السودان مجتهدين بالامكان افضل قلب قلب ,positive
2216,الحقيقة الاستاذة فاطمة الرفاعي مديرة الثانوية الخامسة بتعليم ينبع متميزة بداية عملها التربوي والتعليمي تكريمهم مركز دبي لمعارض اكسبو  وفوزها بجاءزة حمدان راشد ال مكتوم دورتها  استمرار لتفوق ومفخرة لتعليم الملكة وينبع ويدل علا تفوق مربيات الملكة,positive
1807,الامارات الكويت اكسبو دبي يعز العلاقات الاخوية بالاعياد الوطنية رابط التقرير عي ,positive
2401,الجسمي لابس مكان وش الجمال ياربي حبي اكسبو دبي    ,positive
2536,استقبال مذهل وردود فعل استثناءية علا ومنصتها  شكرا لجميع زوارنا بتكوين دبي الامارات ايثريوم دي تي تي كوينز كريبتو عملة مشفرة دوجكوين دي تي تي ,positive
2992,احتفلنا باليوم الوطني لناورو اكسبو  دبي تشرفنا بالترحيب بمعالي رينير ستانيسلاوس غادابو  وزير التغير المناخي والصمود الوطني لجمهورية ناورو  حضر الاحتفال والتقا معالي الدكتور احمد الزيودي  وزير دولة لتجارة الخارجية,positive
2788,تحقيق امنية ترسم البسمة علا شفاه طفلين اكسبو         اكسبودبي البيان القارء داءما,positive
648,اكسبو حلو,positive
543,جناح اوزبكستان عظيم ,positive
2059,خواتيمها دوم مسك دبي جرعة سعادة بشوفتك علا مسرح اكسبو ميحد حمد اكسبو ,positive
1634,زوروا قناتنا علا لاطلاع علا احدث الحلقات الاسبوع يشارك تاتسويا تاناكا المصور والفنان المبدع  وجهة نظره وتفسيره لتكنولوجيا والحياة اليومية التقاطها معرضه المءلف  عملا فنيا راءعا يستخدم تاناكا الاشياء اليومية لتفاعل جمهوره ,positive
4295,  اظهرت الاحصاءيات نسبة كبيرة الاشارات لاكسبو كافة ارجاء العالم  وصلت لاعلا مستوياتها شهر  بمجمل اشارات وصل   اشارة  اكسبو   اكسبودبي   دبي ,positive
259,اكسبو دبي حدث عالمي جميل,positive
1532,تصويري جناح موانء دبي العالمية بمعرض اكسبو تعرفنا علا التدفق الطاقة تحرك الجبال  وتبني مدنا جديدة  وتشيد عوالم جديدة  وتحفز التغير الصورة لشلال رقمي عملاق  مشهد يفوت  ,positive
2398,حفل الموسيقار الكبير عمر خيرت اكسبو دبي حاجه قمة الروعه    علي قناة ,positive
927,عذري انا رحت اكسبو وهالمرة ابي اروح دبي دبي,positive
612,أشعل فارس الأغنية العربية النجم اللبناني عاصي الحلاني أجواء منصة اليوبيل إكسبو دبي بمجموعة أجمل أغانيه وأغاني أخرى التراث الشعبي اللبناني وسط تفاعل وحماس الجمهور رحب بمشاركة ابنه الوليد للغناء إكسبو دبي,positive
1023,الحمدلله رغم الاجواء الحارة الاقبال إكسبو دبي كبير ومع تحسن الجو سنشهد اقبال اكبر إكسبو دبي,positive
1647, اضم صوتي فعلا اكسبو شيء راءع ونتمنا يتم تمديده,positive
1152,تقدر شرطة دبي الجهود المبذولة متطوع تنظيم ونجاح إكسبو دبي شكرا لالتزامكم ومساهمتكم إكسبو دبي,positive
219,جناح دولة الكويت  اكسبو دبي  مشرف وممتع مقارنة بقية الدول يعتبر ممتاز حسنا_اليد  حبيت أصالته استحضار التراث وماضي الكويت الحبيبة وأجدادنا الغالين وبيئتنا الفطرية رغم بساطتها العرض ممتع قلب ,positive
3842,اله يعين الي استلم اكسبو مسءولية كبيرة جدا يقدمه بنفس المستوا الي ابدعت الامارات واخرجته عالمي بكل معايره يقدمه افضل توقعات الناس اكسبو صارت عالية جدا مشاهدة اكسبو شاء اله اليابان هالمسءولية    التوفيق ليابان ,positive
485,البعض فقط يريد ينتقد اكسبو دبي اكسبو دبي فريد نوعه يجمع التجارة والاقتصاد وراحة البال وقضاء اوقات سعيدة العائلة والاصدقاء,positive
2843,جناحة جامعة الامارات     تفاعلي لدرجة يقيمك    اكسبو,positive
1938,دخلتوا جناح الرءية نزلت دموعكم الوطنية والحب والفخر  انا مشاعري جياشه  ,positive
258,اكسبو دبي جدا جميل والمطر خلاه اجمل,positive
3550,رسالة القاءد الاستثناءي بمناسبة ختام اكسبو   ,positive
386,الرياض اكسبو اقسم بالله شي رهيب بصراحة الرياض معرض اكسبو يبين مدى مكانة المملكة عالميا,positive
847,إنجاز جديد نصف زائر لجناح السعودية إكسبو دبي,positive
3161, قريبا بلادي,positive
2112,جديد طلبتنا رحاب اكسبو  علا المستقبل وعقول شابة تذخر المعارف وتكتسب الخبرات  لتقن فن التواصل  وتشارك تشكيل صورة الغد  ,positive
2526,اكسبو دبي نجمة مسرحية طرزان تحي حفلا غناءيا ساحرا عينك علا اكسبو  ,positive
1477, وخلال الحفل  تقدم عفروتو بالشكر لادارة اكسبو دبي علا دعوته لغناء متنا لجمهور صاحبه بالغناء طوال عينك علا اكسبو   ,positive
3520,العين لتدمع القلب ليحزن وانا علا فراقك ,positive
3321,مكاسب تعز موقع الامارات بخريطة العالم حصاد استثناءي لاكسبو  دبي عينك علا اكسبو    ,positive
553,سررت بزيارة اكسبو دبي وشاهدت استمتعت بتسويق الدول لميزاتها التنافسية وزاد الفخر والانتماء للمملكة العربية السعودية جناحها المميز جدا,positive
1233,اكسبو لازم ارد ازوره مرة ثانية يجنن,positive
3360, الفقره مبدعه جدا الغوص علا الءلء حتا الوصول لفضاء القاءمين علا اكسبو ابدعوا المجالات,positive
4294,الحمدله علا نعمة الدار والديار وعلا اجمل انجازات ول الجناح السعودي    ,positive
3487,  اكسبو  رحاب اكسبو عمر ميلاد امل قضيت امتع الاوقات بدات قصتي,positive
3135,بـ اشهر التميز واكثر  اكسبو  دبي تحق تواصل العقول وصنع المستقبل اكسبو  ,positive
3292, كفو شما قصرتو ورفعتو الراس   ,positive
1095,زرت اكسبو شي خيال الصراحة,positive
3590,بنشتاق لـ  جد راءع ومتع ومختلف كلي فخر بالامارات العظيمه,positive
2101,جناح جمهورية التشيك يمثل دعوة لقطاع البحث العلمي بالدولة المجالات المتعلقة بالمياه والطاقة والبيءة خلق تعاون مستمر الجامعات والمنظمات الاقليمية والدولية  بهدف التطوير والاستخدام الامثل والتخطيط والادارة لاستدامة موارد المياه التقليدية وغير التقليدية ,positive
1320,دبي تحتضن اكسبو ليلة مضيئة وافتتاح مبهر نقلته وسائل الإعلام للعالم بكل إتقان دولة الامارات العربية المتحدة الشقيقة,positive
1784,ليلة  حتكون مليءة باحلا الانغام الشرقية كونوا علا الموعد نجومكم المفضلين ,positive
507,حبيت بودكاست المبدع اكسبو دبي وبرمستنا الاماراتية المحلية وبحكم اني يديد لعالم البودكاست اقولك ابدعت والله يوفقك,positive
7,زيارتي لجناح صميم إكسبو دبي يتعرف العالم إرث دولتنا الغني الحدث الأكبر يجمع ثقافات العالم مكان نعتز بماضينا ونفتخر بإرث أجدادنا نتخذ نقطة انطلاق المستقبل,positive
3750,شهد زوار اكسبو  دبي عرضا جويا مذهلا لفريق فرسان الامارات احتفالا باليوم الاخير فعاليات الحدث الاروع العالم    اكسبو دبي ,positive
2725,شكرا لكم  معا صنعنا التاريخ والتاريخ سجل صفحاته  بطل     ,positive
2640, اجمل الاجنحة ,positive
2566,وداعية اخر ليلة تجمعنا ,positive
3827,اكسبو  دبي انجاز باهر وختام راءع  ,positive
1450,اكسبو دبي الاسبوع الجاري واصل تصديه لتحديات وقضايا الامن الغذاءي العالمي والبحث سبل تعزيز ونشر تقنيات الابتكار الزراعي عينك علا العالم عينك علا اكسبو   ,positive
1974,جناح الملكة اكسبو دبي   يستقبل ملاين زاءر  ويحق ارقام قياسية هيءة الاذاعة والتلفزيون,positive
378,حماس الجمهور رهيب قلب قلب  وليد الشامي اكسبو,positive
3423,انتهت رحلتنا اكسبو جءنا بالعالم وتركنا قلوبا سعيدة وعقولا حالمة    وداعا اكسبو   ,positive
2085,حسين الجسمي اعرب حواره الاتحاد فخره يقف لمرة منصة الوصل اكسبو  دبي يستعد لاحياء ليلة استثناءية سهرات امسيات خالدة المتميزة  لاقت رواجا كبيرا انحاء العالم ,positive
678,أحلى شي تسير اكسبو وأنت حاجز الطابور الذكي,positive
773,رحيل الهوادج للموسيقار سليمان الديكان مقطوعة موسيقية فخمة تجد صوت البحر والبادية وتشعر إيقاعها بأثر خطوات الجمال آاه اوركسترا افتتاح جناح الكويت اكسبو دبي لرأيت مستوى آخر بعيد روح الاوبريتات واعلانات العيد الوطني,positive
1995,اكسبو  دبي امسيات خالدة راءد الاغنية الشعبيه فنان الامارات الاو   سعيدة جدا بتواجدي الحفل الاسطوري ميحد حمد الي فاته الحفل  الرابط موجود الحفل كامل,positive
1011,الفنان الكبير ميحد حمد قامة اماراتية كبيرة حافظ التراث الاماراتي وقدمه سهل ومحبب اصبح يردد الوطن العربي حفلته إكسبو دبي تكريم رائع ومستحق لهذا الرمز الاماراتي الكبير,positive
3361,اقرا عد مقال شكرا كفيتم وفيتم بقلم منا بوسمرة  رءيس التحرير المسءول   البيان القارء داءما,positive
2077,حال تسالتوا بيني امر مدهش شاركوا حفل اكسبو دبي وحصلوا تشجيع الجمهور الرءيس وبس انتها جدولهم تفاخر قدام اهله وجلسوا اقاربه يقولونه اوه تشانقبين المشاهرين,positive
3364,تجربة جميلة جدا ومثرية  الحمدله فوت الفرصة الي خلتني اتعرف علا ناس مختلف الجنسيات وصاروا اصدقاءي واجهنا التحديات وساعدنا ورفعنا فخورة فيكم العمل الي قدمتوه     ,positive
3739,غاب عيني وجسمي وعن قلبي حبيبي يغيب   وداعا اكسبو وداعا اكسبو   ,positive
65,يكن المتفائلين يحلم بالرقم اكسبو دبي الظروف حلم وراهن وخطط ونفذ وتابع يومي يستحق الشكر والتقدير لتكفله ببث الأمل مكان العالم وإعادة تفعيله لعودة الحياة لطبيعتها أزمة كورونا الشيخ محمد راشد الفاتنة دبي,positive
3720,القادة العظماء    ,positive
3765,وعدت وفيت سيدي    شكرا دبي شكرا لفريق العمل الجبار     ,positive
3631,الحمدله علا النعمه واكتمال الفضل والمنه مبروك لامارات وشيوخها وشعبها النجاح العالمي  الي نفخر وبنفخر طول هالعالم ينبض شكرا لكل فرد جزءا النجاح ودامت بلادي عز لعز مجد لمجد تالق اخر ظل شعبها وحكومتها العظيمة     ,positive
2250,نتمنا تشوفون حل حق الناس الي واقفين بالطابور ونتمنا تشوفون حل حق الحفلات اليايه اكسبو حدث عالمي يحتاج شي يليق  ,positive
