,Tweet,Class
4915,الأسبوع إكسبو دبي  رحبنا بالمفوض العام لكندا جناح التدفق عرضنا عالم الخدمات اللوجستية للطلاب الإماراتين جلسات حوارية مهنية تفضلوا بزيارتنا جناح التدفق إكسبو دبي,neutral
4983,اكسبو دبي يسجل استقبال حوالي ملاين زائر افتتاحه بداية,neutral
4551,تنظيم وزارة الداخلية مدراء العلاقات العامة والإعلام إمارات المناطق بزيارة جناح المملكة إكسبو إمارة المنطقة مدير إدارة العلاقات العامة والإعلام عادل البقعاوي حائل حضور إرثها وتراثها وكرمها وسط نجاح تنظيمي لافت للجناح وللقائمين,neutral
7249,شلالات اكسبو  دبي تجتذب الزوار الامارات,neutral
5124,تعرف اسرع دراجة كهرباءية بالعالم اكسبو دبي   ,neutral
4997,مدينة إكسبو دبي تبدأ استقبال الزوار وجهاتها,neutral
5811,رعاية صاحب السمو الشيخ محمد راشد ال مكتوم  تنظم الدورة ال قمة المعرفة اكسبو  دبي  يومي  و المقبل  شعار المعرفة حماية البشرية وتحدي الجواءح سعادة الاستاذ جمال حويرب تحدث لمركز الاخبار ,neutral
6947,جناحنا    باكسبو  دبي  يحظا بزيارة تلاميذ المدرسة الاسترالية اكسبو   جناح الجزاءر ,neutral
6426,اكسبو دبي وفد بوليا يزور شركة موانء دبي العالمية  ابوظبي اكسبو دبي,neutral
6920,اكسبودبي يغلق ابوابه اشهر الفعاليات المبهرة  دبي وداعا اكسبو   اكسبو البيان القارء داءما تصوير احمد عبيد ,neutral
7081,الامارات الكشف عد زوار اكسبو دبي انتهاءه,neutral
6454,اكسبو منتدا الطاقة العالمي يستشرف مستقبل امن الطاقة لتفاصيل نتصدر المشهد الاتحاد الاقتصادي اكسبو  ,neutral
5955,تعرض المسجد الاقصا لحرق  استبدال الطبقة الخارجية قبة الصخرة بصفاءح النحاس المخلوط بالكروم والذهب اعطاها لونها المعروف سابقا لونها رماديا وهذه القطعة القبة السابقة معروضة الجناح الفلسطيني    جناح فلسطين في اكسبو دبي     ,neutral
5105,هنا الامارات   اجمالي عد زيارات اكسبو  دبي يقترب  مليونا ,neutral
6283,عملة جديدة امكانات هاءلة سنحضر معرض دبي اكسبو  نتظر عقدا جديدا شبكة الايثيريوم واصدار لعبة ثلاثية الابعاد وحرق العملات تلقاءيا وانشاء محفظتك الخاصة الخاصة  امبراطورية واسمنا شامان كينغ اينو,neutral
5831,صاحب السمو الشيخ محمد راشد ال مكتوم ناءب رءيس الدولة رءيس مجلس الوزراء حاكم دبي يزور جناح المكسيك اكسبو  دبي,neutral
5519,سوق السفر العربي اكسبو دبي حافز لنمو متسارع والسوق تنتظر  غرفة فندقية ,neutral
4957,اللي قالو مب لازم نروح اكسبو مافي شي يحمس اللي مسوين زحمة الحين,neutral
6200,بلا وصي دعوة لـ المساواة حصول النساء علا الرعاية الصحية لعيون        اكسبودبي البيان القارء داءما,neutral
6254,خبراء ماليون سويسريون لـ البيان دبي جاهزة لتمويل المستدام    اكسبو دبي البيان القارء داءما,neutral
6893,اكسبو دبي يحتفل بيوم المكتب الدولي لمعارض لتفاصيل  عينك علا اكسبو  ,neutral
5405,يدعو  جماهير مان سيتي لحضور عرض مباشر لمباراة ديربي مانشستر بحضور ضيف خاص    حديقة الاحتفالات الاحد الساعة بتوقيت الامارات,neutral
4913,الدخول مدينة إكسبو دبي مجاني وسيكون جزء كبير المساحات العامة مفتوحا للتنزه رسوم ويمكن للزوار استخدام الخدمات المتاحة العربات وقطار مستشكف إكسبو والسكوتر الكهربائي والدراجات الكهربائية رسوم,neutral
5474, جناح سلطنة عمان وفالنا يارب الفوز,neutral
6103,منتدا المءسات الشبابية الخليجية برامج اكسبو دبي       يهدف لاستعراض التجارب والخدمات والتوجهات المشتركة المءسات المشاركة  والخروج بشراكات تساعد الاطراف علا توسيع داءرة عملهم لتسجيل نتشارك المعرفة ,neutral
6251,رءيس الانتربول يشيد بجلسات القمة الشرطية العالمية        اكسبو  دبي البيان القارء داءما,neutral
4641,وصلني دبي مول زحمة ستي مردف زحمة القرية العالمية زحمة اكسبو زحمة محدثكم مول الامارات زحمة عمار يادبي,neutral
4534,صور سعادة العميد الشيخ محمد عبدالله المعلا مدير الإدارة العامة للتميز والريادة ونائبه العميد الدكتور صالح الحمراني يطلعان العرض يقدمه الجناح الجوي للزوار منصة شرطة دبي بجناح فزعة إكسبو دبي أسبوع الجناح الجوي,neutral
5086,   السنة اقيم معرض اكسبو دولة الامارات دبي وبعدها سيقام السعودية وهذا حسابهم الامارات  اكسبو اكسبو  دبي  ,neutral
5005,احتفالا بمئوية الدولة العراقية زرنا وفد الهيئة الجناح العراقي معرض اكسبو دبي التعريف بحضارة بلاد الرافدين أصالتها عمق العراق الحضاري مقدمة لمسناه الجناح العراقي يدار ثلة شبابية عراقية طيبة نتمنى لبلادنا تكون دوما محط أنظار العالم ,neutral
6000,يمكنك الوصول اكسبو بسهولة  اركن مركبتك مواقف محطات مترو سنتربوينت اتصالات جبل علي عقارات جميرا لجولف انطلق برحلة مريحة عبر مترو دبي باتجاه محطة اكسبو  لتصل اجنحة المعرض مباشرة اطلع علا ساعات عمل المترو ,neutral
4524,الشيخة لطيفة بنت محمد راشد آل مكتوم تزور الجناح السوري إكسبو دبي,neutral
5805,تعرض المسجد الاقصا لحرق  استبدال الطبقة الخارجية قبة الصخرة بصفاءح النحاس المخلوط بالكروم والذهب اعطاها لونها المعروف سابقا لونها رماديا وهذه القطعة القبة السابقة معروضة الجناح الفلسطيني    جناح فلسطين في اكسبو دبي      ,neutral
5836,صاحب السمو الشيخ محمد راشد ال مكتوم ناءب رءيس الدولة رءيس مجلس الوزراء حاكم دبي يزور اكسبو  دبي  ويتفقد جناحي كرواتيا والدومينيكان الحدث العالمي ,neutral
7220, بتحصله اكسبو دبي مو اتروح اكسبو اليابان اسف قصدي كوكب اليابان كوكب اليابان مقصودة طبعا,neutral
4523,عرض ازياء الجناح السعودي معرض اكسبو دبي بمشاركة تيما عابد شهد الشهيل لماركة اباديا اروى العماري لماركة ارام التصفيق ,neutral
5194,استكشاف اكسبو  ,neutral
5528,اكسبو دبي الالعاب النارية تخطف الانظار عرض اسبوعي رابط التقرير  عينك علا اكسبو  ,neutral
7212,و مشارك البطولات والفعاليات الرياضية الدولية اكسبو  دبي وام ,neutral
6591, اعتلا الاعبان المنصة اولا  تحدثا امور  بدءا نجاح النادي الموسم حتا الان  مرورا بنجومية زميلهما ابراهيموفيتش  وصولا مقالب غرفة تبديل الملابس وكمية المعكرونة يتناولانها  انضم اليهما بيولي جلسة اسءلة واجوبة عينك علا اكسبو  ,neutral
7108,  دولة ملاين الزوار نودع اكسبو  دبي ونسلم المكتب الدولي لمعارض مثلي اكسبو  اوساكا        ,neutral
5107,الاحاطة الاعلامية لـ اكسبو  دبي تسجيل قرابة  المعرض الدولي  يوما اكسبو  رادار نيوز مراة الخبر,neutral
6184,رءيس وزراء كرواتيا علاقاتنا متميزة الامارات لتفاصيل  نتصدر المشهد نهيان مبارك يتلقا لوحة اسطورية فرنسا لتفاصيل  نتصدر المشهد اكسبو  ,neutral
5589,الجناح البرازيلي       ,neutral
6252,زوار جناح الولايات المتحدة اكسبو  دبي تجربة مفعمة بالحيوية والترفيه وتناول العشاء مجسم نسخة طبق الاصل صاروخ سبيس اكس فالكون        اكسبو     البيان القارء داءما,neutral
4500,| جانب سمو ولي العهد الجناح السعودي معرض إكسبو دبي ولي العهد الإمارات ,neutral
6493,فقط اكواب قهوة العالم   وتجارب لذيذة تفوت جرب القهوة الكولومبية جناح كولومبيا باكسبو  دبي    اكسبو دبي ,neutral
6310,اكسبو معرض عالمي وفيه لجنة دولية تحد توقيته واقصا مدته شهور دبي حصلت موافقة استثناءية ليكون وقته بداية اكتوبر الشتاء بدل المعتاد الصيف بداية اكتوبر,neutral
4751,عادي اجي دبي السعوديه واروح اكسبو عادي لازم فحص كورونا دخول,neutral
6505,  مع اقتراب فعاليات الحدث العالمي اكسبو  دبي يسجل   وقرابة الـ افتراضية اكسبو    ,neutral
5332,جمهورية فانواتو شعب السعادة تحتفل بيومها الوطني اكسبو دبي عينك علا اكسبو    ,neutral
6478,معلومات تعرفها الدول المشاركة اكسبو  دبي        اكسبو  دبي البيان القارء داءما,neutral
4836,سافر جناحنا وتأكد الحصول ختم الجناح الخاص جواز سفر إكسبو الخاص شارك بصورك تحمل طابع جناحنا جواز السفر الخاص تنس وضع اسمنا البوست للحصول فرصة للظهور صفحتنا إسرائيل إكسبو دبي إكسبو دبي,neutral
5555,رءية عمان   بيءة عناصرها مستدامة     اكسبو  اكتشف امة  ,neutral
6982,اصحيح ليلة الوداع اكسبو ,neutral
7128,اكسبو دبي  تغطية ,neutral
7070,استبيان   شركات القطاع الخاص دبي حقت نموا فترة تنظيم اكسبو  دبي ,neutral
6127,حصل اكسبو دبي علا تكريم المعيار الدولي والاوروبي لمساواة الجنسين الخاص بتنظيم الفعاليات اليكم التفاصيل عينك علا اكسبو  يوم المراة العالمي   ,neutral
6688,التقا معالي صقر غباش رءيس المجلس الوطني الاتحادي  مقر اكسبو  دبي  معالي ماركيتا بيكاروفا اداموفا رءيسة مجلس النواب جمهورية التشيك والوفد المرافق,neutral
6956,بارك اله ريم ابراهيم الهاشمي العضو المنتدب لمعرض اكسبو       ,neutral
4772,قابلتم فريق التواصل المجتمعي كاتش باتش؟ إنهم يقومون بنشر الوعي خدمات الرعاية النفسية والاجتماعية وخدمات الرعاية التلطيفية للأطفال معرض إكسبو دبي اضغط الرابط البايو لمعرفة المزيد خدمات كاتش وباتش,neutral
6593, الزيارة الاولا الماضي  ساعات مباراة ديربي الغضب ضد انتر ميلان  والتي انتهت بفوز الروسونيري بنتيجة   وتكرت الزيارة شهر الجاري مباراة كالياري  والتي حسمها ميلان لصالحه  لينفرد بصدارة جدول ترتيب الدوري الايطالي عينك علا اكسبو  ,neutral
4715,اقدر اتجاهل حفل آلاء الهندي بحفل اكسبو دبي رحت اشوفه كامل,neutral
6213,جناح الكويت اكسبو دبي جولة تعريفية لمنظمين الجد  مجلس الامة وزارة الداخلية هجوم العمالقة وسم نيوز ,neutral
5057,بهدف توحيد الجهود العالمية لتحقيق مستقبل امن لغذاء انطلاق اعمال قمة مستقبل الغذاء والمعرض العالمي لتقنيات الزراعية والابتكار اكسبو عينك علا اكسبو  ,neutral
6084,جنوب اكسبو  دبي يشهد العرض العسكري الميز حصن الاتحاد يظهر مدي قدرة وجاهزية القوات المسلحة لدفاع الوطن    ,neutral
6028,اكسبودبي  تبرع بابتسامة    الامارات دبي اكسبو صحيفة الخليج الخليج خمسون عاما ,neutral
5734,اجندة اكسبو    الامارات اليوم,neutral
7039,اكسبو ماقبل الاخير    اكسبو   ,neutral
4825,هالحين دبي حر ليكون عندكم جو سويسرا؟ بعدين أكسبو أبتداء الجو ربيعي كثر كذبكم صرتم تصدقون كذبكم قوية جدا,neutral
7067, شخص زاروا اكسبو دبي  الخليج اونلاين ,neutral
6177, المكن تمديد فترة اكسبو  شهر زيادة,neutral
4824,والله اللي وصلني وقالي ممكن تبدأ الحفلات اكسبو دبي اعتدال الجو واحتمال لشتاء لان شتاء دبي دوم يجيك معتدل وتنفع للحفلات الغنائيه,neutral
7034,جازية البحرين اكسبو الامارات ,neutral
5592, سوا حفلة لعيضة شهر ,neutral
6501,شو رايكم اخر اسبوع رمضان تفتحون  ساعة  ,neutral
7114,فيديو الحظات اغلاق جناح الكويت انتهاء موسم اكسبو  اكسبو دبي ,neutral
6553,تعرفوا علا جناح سنغافورة معرض اكسبو دبي   سولارابيك اكسبو دبي  اكسبو دبي الامارات  ,neutral
5132,تحتاج حتا تخلق فرصة وترك اثرا بالمجتمع  تكتشفه جناح عالم الفرص اكسبو دبي عينك علا اكسبو  ,neutral
6572,اختم مركز الاعتماد الخليجي مشاركاته  جناح مجلس التعاون لدول الخليج العربيه باقامة ديوانية الاعتماد الثانيه ندوة دور الاعتماد جودة المياة واستدامة الموارد الماءية بحضور عد المهتمين شءون المطابقة والجوده  جودة المياه ,neutral
5648,يراقب عد المرات غسلت يديك يستخدم جناح استراليا باكسبو  دبي نظاما ذكيا لتوفير المياه ,neutral
5588,  ها ساحة الوصل سو عروض وتخريج عسكري احس الميز بينهم وسوه كانه عرس,neutral
6990,نجوم حفل ختام اكسبو  حدث ميز ومتعد الثقافات  كريستينا اغيليرا دبي  ,neutral
5932,سفير الالحان فايز السعيد يقدم الفن الاماراتي الاصيل امسيات خالدة بـ اكسبو دبي  مع اكسبو علا تلفزيون دبي ,neutral
5294, انا اطالب يمدونه,neutral
7186,منو حضر اكسبو  خبروني بلد حبيتوا   دبي,neutral
7058,وام توقع اتفاقيات اكسبو كبريات المءسات الاعلامية امريكا الاتينية          اكسبو  دبي    اكسبو     البيان القارء داءما ,neutral
5581,كندا تكرم المراة اكسبو بفعالية نساء يلهمن النساء    الامارات اكسبو دبي الخليج الاقتصادي الخليج خمسون عاما,neutral
5013,صديقى دبى واسمه جاستن ماكجوان مش السفير الاسترالى المفوض العام لحكومة استراليا لشؤون اكسبو سفير استراليا الامارات سيدة,neutral
5322,هل تعلم تستضيف ورش عمل وجولات تصوير مختلفة   يطلعنا براد علا جولة التصوير حدثت محترفي كانون  يمكنكم استعارة احدث كاميرات اعرفوا المزيد انشطتنا المختلفة كانون الشرق الاوسط اكسبو دبي,neutral
7152,زيارتي لجناح الام المتحدة اكسبو   اكسبو  دبي اكسبلور  ,neutral
6713,الامارات      محمد راشد يلتقي رءيس جمهورية جنوب افريقيا  وذلك جناح بلده اكسبو  دبي  جرا بحث افاق التعاون الدولتين وسبل دفعها قدما الامارات دبي جنوب افريقيا ,neutral
5427,تذوق اطعمة ويلز تجربة فريدة جناح بريطانيا بـ اكسبو دبي رابط التقرير  عينك علا اكسبو  ,neutral
7016,فتاة اذربيجان حزينة اخر اكسبو,neutral
6301,القنصل العام لولايات المتحدة يثني علا الجهود قدمها اكسبو  دبي دعم راءدات الاعمال العالم ,neutral
5550,الاسبوع حافلا بالفعاليات الميزة  المسابقات المتعة والانشطة الترفيهية ترقبوا فعالياتنا لاسبوع اكسبو  زوروا صفحاتنا علا مواقع التواصل الاجتماعي لمعرفة المزيد تابعونا الاسابيع الاربعة  كانون الشرق الاوسط اكسبو دبي,neutral
5273,سعادة عزة بنت سليمان  الامين العام المساعد لشءون الادارية والمالية الجنة الاولمبية الوطنية وحديث الرياضي الوطني  هنا العالم اكسبو   ,neutral
6278,جناح الملكة يستضيف عرضا فلكلوريا تايلنديا معرض اكسبو  دبي,neutral
6495,اكسبو  دبي بث حي لفعاليات الحفل الختامي علا منصة اكسبو الافتراضية    الامارات اكسبو دبي,neutral
5855,جمهورية الدومينيكان تحي يومها الوطني اكسبو دبي ,neutral
4598,بينما تتجه أنظار العالم إكسبو دبي دعونا ننسى افتتاح الموسم ال القرية العالمية بالنسبة مكان مثالي لقضاء أجمل الأوقات برفقة العائلة والأصدقاء أنشطة ترفيهية طعام مرح,neutral
7052,رقم تاريخي زاءر لـ اكسبو العطلة الاسبوعية شبكة الامارات الاخبارية,neutral
5382,اليكم ابرز احداث اكسبو دبي نشرة العين الاخبارية عينك علا اكسبو   ,neutral
5093,رعاية هنكل المصمة حصريا لمعرض اكسبو دبي يستعد  طالب تراوح اعمارهم و لمشاركة المسابقة المدرسية ينظمها مختبر عالم المستكشف عينك علا اكسبو   ,neutral
4881,ظمن احتفال المغرب باليوم الوطني إكسبو دبي تنظيم مؤتمر دولي أعلى مستوى بعنوان المغرب الصاعد التقاليد والطموح بمشاركة فوربس الجمع أعضاء اللجنة المغربية والدولية لمناقشة الفرص الجديدة أتاحتها قيادة المملكة المتطلعة المستقبل,neutral
5709,اضاءة قبة الوصل اكسبو  دبي بالالوان الاربعة تميز الامراض النادرة اكسبو   رادار نيوز مراة الخبر,neutral
6484,بحضور الشيخ نهيان مبارك بدء حملة شكرا متطوعينا والتي يطلقها اكسبو دبي لتكريم المتطوعين المشاركين اكسبو        اكسبو  دبي البيان القارء داءما ,neutral
5906,ميحد حمد اكسبو دبي ,neutral
4972,يعني عادي نروح اكسبو علشان ناخذ ريحة بيبي بعير ,neutral
6488, وتضمنت موكبا قادته الفرقة الموسيقية لشرطة دبي  تبعهم شباب المجتمع الاماراتي وساروا معا حاملين رايات بيضاء تحمل شعاري الامارات لطبيعة والصندوق العالمي لطبيعة عينك علا اكسبو  ,neutral
4817,الخير ناس دبي رايحين اكسبو الجو عندكم؟,neutral
6609,وصلت الزيارات الافتراضية عبر المنصات الرقمية  مدفوعة بمجموعة الفعاليات الترفيهية المتاحة عبر منصة لايف اكسبو اكسبو  ,neutral
5257,اكسبو  دبي فعاليات حافلة اليوم الدولي لمراة رابط التقرير عينك علا اكسبو  ,neutral
6705,محمد بن راشد يلتقي رءيسي جنوب افريقيا ليبيريا اكسبو  دبي الشارقة,neutral
4774,استعرضت منصة إقامة دبي أيام الحدث الخمسة حزمة المشاريع المبتكرة تشمل الإقامة الذهبية والتطبيق الذكي ومنصتي وإقامة دبي اللاورقية خدمات الجنسية وجوازات السفر وخدمة مميز والموقع الالكتروني وخدمات إقامة دبي إكسبو دبي,neutral
5424,اكسبو دبي اطلاق خطة تحويل افريقيا لمحطة طاقة عالمية رابط التقرير  عينك علا اكسبو   ,neutral
5344,تكشف اليابان عبر جناحها اكسبو دبي لزوار اعجوبتها التكنولوجية الفريدة  الروبوت الشهير التر عينك علا اكسبو   ,neutral
5902,احتفلت الدومينيكان بيومها الوطني بحضور رءيستها  اكسبو  دبي نعرف الدومينكان حضور قساوسة بالموصل ولهم  ومنهم صنف كتبا تاريخ المسيحية بالعراق  وجود رءيسة جمهورية يدحض رواية نقل الحديث الاحادي فلاح تولي امرهم امراة  وكم امراة تولا مهمات اولا العالم,neutral
5924,ليش انعرض حفل ميحد حمد قناه اكسبو دبي,neutral
6385, عليكم  يسمح بطفل عمره وطفل اخر عمره  بدخول اكسبو دبي  لان بحثت الموقع لقيت,neutral
5985,كنت انتظر اكسبو بفارغ الصبر اني الزاءرين لدبي بسب مشكلة مالية استطيع السفر دعاءكم بنهاية المشكلة اكسبو  دبي محمد راشد,neutral
4695,جانب مشاركة الهيئة الاتحادية للهوية والجنسية والجمارك وأمن المنافذ فعاليات الدولة احتفالا بعيد الاتحاد الخمسين وذلك عبر تقديم تذاكر دخول معرض إكسبو دبي للقادمين عبر المنافذ الهيئة الاتحادية للهوية والجنسية والجمارك وأمن المنافذ احتفالات الخمسين,neutral
6250,خيارات عالمية لوجبة افطار شهية اكسبو         اكسبودبي البيان القارء داءما,neutral
6324,مدير عمليات الاستدامة حصول اكسبو دبي علا المعيار الاوروبي والدولي لمساواة الجنسين انجاز جديد لامارات,neutral
4924,التقى معالي محمد هادي الحسيني وزير دولة للشؤون المالية ماركوس ترويخو رئيس بنك التنمية الجديد لدول البريكس وذلك هامش فعاليات معرض إكسبو دبي حضر اللقاء سعادة يونس حاجي الخوري وكيل الوزارة وزارة المالية الإمارات,neutral
7125,معرض اكسبو دبي لتاريخ,neutral
5512,النقاشات اسبوع الغذاء والزراعة وسبل العيش اكسبو دبي خبراء يكشفون امكانية اطعام ملياري شخص اضاف ,neutral
4559,اكسبو رهيب المشي يباله لياقه,neutral
5812,بو عبداله الخبير انا قاعد اتكلم مشاركة المشاريع اكسبو دبي انت شنو تقصد بكلامك مشاركتك شنو افهم,neutral
