,Tweet,Class
9563,نريد نفطا نريد غازا نريد طعاما نريد فقط لشركة أرامكو سنكون والنورة للطاقة دولة الدعارة نريد مصفاة ومطارا ومعرضا قصفنا الغاز والمسيرات السهل نعاني العدو ونموت يعني استطعت رفع الازمة ارفع رؤوسنا وزد خيرك,negative
9564,البنزين والغاز ونحن نريد الغذاء نريد القصف لشركة نفط نوبل والنورة ومشروع الطاقة دولة الدعارة نريد مصفاة دمشق ومطار دبي ومعرض إكسبو قصفت بالصواريخ الباليستية والمسيرات السهل نعاني طريق العدو ونموت يعني بأي نسبة وأكثر خيرا,negative
9565,بدأ بطرد إسرائيل الاتحاد الشريف للمخترعة الكويتية جنان الشهاب معرض دبي للتطبيع وانتهى بسقوط كبابتها الأردن وتراجع شارع دبي فستيفال جنوب أفريقيا قبول تمويل الاحتلال الشركات الدولية تدين إلغاء اسمها عنصري,negative
9566,الحال طرد إسرائيل الاتحاد وانسحاب المخترع الكويتي شهاب إكسبو دبي وانتهى بسقوط رالي باجا الأردن مهرجان الشارع جنوب القبول تمويل الاحتلال وتقرير منظمة العفو الدولية أدانه بوصفه بالنظامين العنصرين,negative
9567,بدأت إسرائيل الاتحاد الأفريقي والانسحاب المشرف للمخترعة الكويتية جنان الشهاب معرض دبي للتطبيع سقوط رالي باجا والتراجع الشارع أفريقيا قبول الاحتلال وتقرير منظمة العفو الدولية الفصل العنصري,negative
9568,إكسبو أفضل تحفة القنبلة الطبيعية الهندية,negative
9569,مؤتمر مستمر للجناح الهندي حشد طبيعي,negative
9570,الطابور الانتظار مزدحم,negative
9571,لديك مقارنة دولة ليوطي الجزائر حضارة سوريا ملكة تدمر عيد الميلاد مرورا بالدولة الزيرية تأسيس الجمهورية يعود ليوطي سرقة التراث السوري آخر السرقات وكتابنا إكسبو دبي عرف,negative
9572,الحقيقة فمقارنة دولة ليوتي الجزائر حضارة بريطانيا بملكة نوميديا المولد مرورا بالدولة الزيرية الجمهورية الحديثة دولة ليوت بريطانيا وجيرانها بينما نايلة دبي تعرف العرب,negative
9573,لديك الحق مقارنة الجزائر ليوتية تركيا ملكة نوميديا سوريا الدولة الجمهورية الحديثة ولاية ليوطي تسرق التراث السرقات معرض فتيات النيل دبي العرف العربي,negative
9574,دور الفنان أيمن حمد تلفزيون دبي وعرضه عد أغانيه الجميلة ناتاناتا نقطة سلبية تنعكس فينا,negative
9575,أشاد بحضور الفنان ميهاد حمد إكسبو دبي دبي بأغانيه ترسم خطوطا سلبية انعكست,negative
9576,اطلالة حضور الفنان ميهاد جميل دبي وعرضه لصوت أغانيه الجميلة للشباب المعارضة السلبية وعلا,negative
9577,تحقيق منطقة باليستية للهبوط العسكري منطقة الأعاصير مقرها شعار دولة الإمارات العربية المتحدة فقط انتظر الإعلان مشاركة اليمن الأكثر إثارة وإثارة معرض,negative
9578,دائما هبوط باليستي إسرائيلي عنيف إعصار اليمن مكان المعرض شعار آمن عالم الدعاية والإعلان اليمن المعرض الأكثر إثارة وإثارة للمعارض والقادمة بإذن الله,negative
9579,تليها عمليات المراقبة الباليستية العسكرية إعصار الإرهاب شعار مقر؟ فانتظر الإعلان مشاركة اليمن معرض دبي الأكثر إثارة وتشويقا الله الأعظم,negative
9580,النفط وتركيباته تدمر اليحر وتخبرك بالحقيقة رابط,negative
9581,ضريبة البترول لزيادة أسعار التذاكر ضربتها دبي مباشرة,negative
9582,ومجموعاتها ترفع الشاي الساخن الرغم أنه,negative
9583,زرت فندق اكسبو ميلانو بافيليون دبي الاثنين وللاسف برازيلي فقير اكسبو يعكس ثراء سياحيا يضاهي سمعة لبنان المالية جناح فقير جدا العلم جميلين ونشرح,negative
9584,زرته اكسبو ضيفنا دبي الاثنين وللاسف جناح ريد ميلان فقير فهو يعكس رأيه وسمعة الشعب جناح فقير جدا العلم اقل منا دول جميلة وشرح,negative
9585,انا متحف اكسبو ودبي اكسبو الاثنين وللاسف جناح سيدني اكسبو رديء فهو يعكس ويقارن بسمعة دمشق الجناح فقير جدا العلم دولا اقل منا معنا,negative
9586,وكيلة وزارة الإعلام منيرة الهويدي وتدليك الله بالخير ثانيا سعادة وكيل الوزارة طلب الفنانين الوشنوة أخذتهم معك دبي وكم حساب المال العام وزارة الإعلام الإجابة,negative
9587,وكيلة وزارة الإعلام منيرة الهويدي أولا قم بتدليكها ثانيا اسأل سعادة وكيل الكلية الفنانون موظفون الوشنة دورهم محاربة وكم تكلفة رحلة فنان علنا جواب وزارة الإعلام,negative
9588,وكيلة الوزارة منيرة الهويدي اولا تدليك جيد ثانيا سؤال اغلب الفنانين منسوبي وزارة كوشنو دورهم اصطحابهم للتعامل اكسبو دبي موظفي رحلة الفنان حساب المال العام وزارة الاعلام,negative
9589,لكل يقول خيانة دول أهمها إيران كلهم شاركوا لبنان,negative
9590,يقول يتعلموا يدعوا خربوا وتوابعها كلهم كسبوهم إسرائيل,negative
9591,يقول الطبيعة الدول الغربية فرنسا وشعب إسرائيل,negative
9592,نذكر محطة التحلية الخطوط الشمالية توجد مطاردات منزلية,negative
9593,وحقل نفط ارامكو قديم برج مصباح,negative
9594,سخنين يلتقي الباجر دبيان مطار دبي,negative
9595,انا الله خير متصرف الشؤون عليهم الأغاني يضعونها بخصوص أعياد العيد الوطني التحرير يقف بابك فضحتني فالينا المعقول نسمعه مشاركتنا معرض دبي إكسبو فاقت الملاين يجب علينا تدقيق النفقات,negative
9596,الله يكفينا خير أمين وضعها يتعلق بالاحتفال بالأعياد الوطني التحرير واقفا ونمشي الهواء نسمع تكلفة مشاركتنا كسبوا الملاين والملاين يجب علينا تدقيق النفقات,negative
9597,يكفيني الافضل المتصرف الشؤون ضدهم الغناوي يعيش علاقتنا بالأعياد الوطنية الوطني وعيد يقف بابك وأهل المرح عادلون معقول نسمعه يجب التحقق تكلفة مشاريع دبي تجاوزت الملاين رابط,negative
9598,فقدان حق فشل كارثي فقد كسبوا الآخرين كأمانة لذلك اضطر أموالهم,negative
9599,للأسف السوق اكسبكم خسارة تجار دمشق للسوق,negative
9600,للأسف الصواب وعذر إكسبو غيره يثق بسوقه,negative
9601,تضيعونهم عليهم كنتم تريدون إسكات العالم كله بقصة تستخدمها نساء أطفال النيل المطلوبين للحصول بطاقة,negative
9602,لرؤيتك تضيع عليهم أردت لديك الثناء العالم كله لدينا المغرب استخدامه كنيل أراد يخدع أنهم رابط,negative
9603,يضيعوا لأنفسهم أردت منكم الدنيا تسمعوا قصة ماروك استخدموا صور امرأة أبناء فرعون مرارتكم,negative
9604,الخدمات تقدمونها سيئ بالنسبة تسميها واحدة موحدة بحيث لديك قطيع المصرين المدربين خداعنا لإنجاز شيء أين؟ المواطن السعودي الهتين الراضي,negative
9605,أشهد المواطنون السيئون وخاصة الرقم موحد أزلتم قطيع المصرين المدربين علينا خدعونا بإنجاز شيء تشجيع المواطن السعودي وأنتم الطريق,negative
9606,أشهد خدماتكم تقدم لمواطني لبنان وخصوصا تدعون أنكم متحدون علينا المصريون المدربون تخدعوننا تنجزونها تشجيع المواطن السعودي وأنتم تضعون الأردن,negative
9607,شيء فاخر مفقود علينا وطباعة كبيرة تدعو الشمس للحرق,negative
9608,إنذار محلات بدون شعار اكسبو بصراحة الشمس,negative
9609,نكن بحاجة إكسبو دجاج بدون الشمس يحترق,negative
9610,أتمنى أذهب أجله والآن أذهب أجله,negative
9611,أخشى أذهب دبي كنت ستجدهم العشاء,negative
9612,أتمنى أذهب وسط حشد وجدت قلقي للذهاب,negative
9613,أعترض المشاركة بالكتابة كشخصية ثقافية بصور وتماثيل الشتائم قتل معارضي نظام الأسد وصورة سليماني إكسبو دبي,negative
9614,المشاركة الإيرانية الكتب والإنتاج الثقافي والتماثيل الحرب تسبب آلاف السورين المعارضين لنظامين صور أنقذت,negative
9615,أعجب بالمشاركة الإيرانية؟ وإنتاجات ثقافية ضد وتماثيل مجرم حرب وقتل السورين ونظام الأسد صورها سليماني إكسبي,negative
9616,إكسبو استفزاز كامل الجناح,negative
9617,استفزاز أجنحة إكسبو,negative
9618,شاشات إكسبو دبي السليمانية,negative
9619,وجدنا تسجيل كاميرا حصلوا,negative
9620,وجدنا دار ماني ريف دبي,negative
9621,وجدنا كاميرا ابنتي دبي,negative
9622,دبي شرطة الأمن العام,negative
9623,لقد دمرت إكسبو,negative
9624,دبي هايت دبي,negative
9625,بقول شيء أصبحت لذلك رابط,negative
9626,أقول أنه أذهب لدي قلب أخضر يشعر,negative
9627,سأخبرك بشيء ألعنه,negative
9628,منظمة رأيت نصفها شاهدت تصويرها يظهر وسائل التواصل الاجتماعي شيء يحدث وراء اهم شي الفوضى تقومون حفلات بالكثير المال المهزلة حدثت تريد تنظيمها المشهد يرضيك,negative
9629,منظمة مثيرة للاشمئزاز أرها الحفلات العروض الاجتماعية شيء يحدث وراء شيء فوضى أصبحت الكثير الحفلات بالمال المهزلة أفضل ولعالمي تريد تنظيم حفلات ترضيك بهذا المشهد,negative
9630,المنظمة الأكثر فشلا وكلمة تقول حق رأيته تصوير الحفلات أجلي؟ وسائل التواصل الاجتماعي شيء يحدث شيء فوضى أصبحت فوضى أصبحت الحفلات احسنت رايمن تنظم حفلات ترضيك بهذا الرأي,negative
9631,إلغاء الهروب المهني وبدون خطاب جدات الهروب انتهت صلاحية الإقامة تخفيض التعويض المالي تعديل رسوم التسوية المهنية الفردية إلغاء بصمة البصمة بصمة الهجرة بصمة الحج والنقل والتأشيرة اتصل,negative
9632,الإلغاء المهني تحسين الصحة وبدون حرف منح لجده بلاغة الإقامة منتهية الصلاحية أوراق إصدار بطاقة العمل تعديل الوظيفة التعديل المهني الفردي إلغاء بصمة الهجرة بصمة الحج إلغاء قرار نقل الكفالة استبدال إجازة,negative
9633,الإلغاء المهني والأفراد وبدون خطاب منح لجده تقرير الهروب إقامة منتهية الصلاحية تخفيض العجز المالي إصدار بطاقة عمل التجديد المهني التعديل المهني الفردي إلغاء بصمة ترحيل البصمة يتعلق الإلغاء بإصدار تأشيرة,negative
9634,لديك آخر تلحق بسيارة غولف ستكون معك يأخذك مكان منزل لتوفير الجهد يدور حد الوصول الجدول الزمني,negative
9635,لنهاية الشهر للقبض شال وتقديم جولة جولف مكان بسرعة أجنحة القصيدة تذهب,negative
9636,مرة تتبع شال لنهاية الشهر لسيارة تكون مناسبة بسرعة والجهد وحده تظهر الأجنحة للذهاب جدول زمني,negative
9637,مزيد؟ يحرج سعادتك أرسل مقاطع فيديو سخرت معرض الكويت مباشرة لعدم انتهاك الذوق العام المناسب انتظار موافقتك وكيل,negative
9638,العدان سعادتكم أرسل السخرية معا وجه مباشر يخالف الذوق العام ينتظر الوكيل يرى الوكيل صورة الكويت دبي,negative
9639,اللحاق بالركب والسابق وإحراج سعادتك إرسال فيديوهات السخرية جناح الكويت وثائق إكسبو لعدم مخالفة الذوق انتظار موافقتك شوهت صورة الكويت,negative
9640,بمجرد يصفق ويضحك ويركل مدير الرقص جناح الحفلة بحضور علا وسمع الوكيلة وموظفي مكتبها وبماذا تحقق لأنها ترفع المشهد وتضحك أخذته معها وكيل الإعلام الخارجي,negative
9641,لذلك يعمل ويضحك ويقبل ويقبل راقصة جناح الكويت بحفل إكسبو دبي وبحضور علا نائبته مسؤولة بحكم عمله طاقمهم والتحقيق لأنها راضية المشهد وحتى التصفيق أخذه معها الوكيل الإعلامي,negative
9642,مرة واحدة الشخص يصفق ويضحك ويركل ويقبل المدير الفعلي لمعرض دبي إكسبو وبحضور ويسمع وكيله الرسمي بحكم عمله موظفي مكتبها ومعا لأنها راضية المشهد وتضحك وتصفق أخذه معها وكيل الإعلام الخارجي,negative
9643,وكيل وزارة الاعلام تستدير وفق قانون الخدمة وتعين موظفين مكتبك للتقاعد ولماذا ارسلتم وظيفة مهمة اكسبو دابيا المدير عمل قوائم المكافآت ويذهب مهمة رسمية دبي لمدة شهرين وحساب الوزارة الوزير يعلمه,negative
9644,وكيل وزارة الاعلام ينتج قانون الخدمة المدنية وقمت بتعين مدير موظف محل كوليشي ارسله مهمة رسمية دبي اكسبو وانه يحيط اسمه قوائم المكافآت ويذهب مهمة رسمية لمن رفع حساب الوزارة يعلم,negative
9645,وكيل الوزارة استدرت مساعد الوزير المدني وعينت مديرا لمكتبك موظفا متقاعدا عمل مهمة رسمية دبي اكسبو لهذا المدير لشخص اسمه قوائم المكافآت ويذهب مهمة رسمية شهرين حساب الوزير الوزير يعلمه,negative
9646,للأسف الجناح الناس اكتسبوه كدب ويجلسون رأي الناس بينهم الداخلية الكويتية,negative
9647,للاسف الجناح الكويتي يهين الناس وهم يخدعون حمودي والاعلام الكويتي رأي وكويتيون,negative
9648,للأسف استمرت أهل الكويت بالفراء وزارة الري الكويتية,negative
9649,إنها نسوية بسيطة يحترم بلده والمحافل الأجنبية يشوهون الصورة انظر الفيديو معي التحليل الجناح السعودي إكسبو دبي الأغاني التراث الشعبي الوطني يعني صامتة منيرة الهويدي,negative
9650,انا بسيط يحترم بلده وزارة الخارجية وبين يشوه صورة بلده عندي تحليل الفيديو السعودية فرع دبي للأغاني حتا الرقص الشعبي يعني مانيت صمت الهويدي,negative
9651,نجري مقارنة بسيطة بينهم منتديات دولتهم وبين تشويه صورة دولتهم معي قسم التحليل السعودي دبي إكسبو اغاني وطنية حتا الرقصة يعني لماني عارف شلون صامت منيرة رابط,negative
9652,وبنفس الغباء دبي إكسبو يكن متعمدا تشن الأيدي الخبيثة حروبا لمحاولة إطالة تاريخه وهويته أصيبوا بخيبة أمل وخيبة أمل مسعاهم الأردن الأردن أجنبي والتراث العربي يجب يحاسب ويحمل المسئول الخطأ الشنيع,negative
9653,بنفس الغباء وكسبوها عمدا وكأنهم يحاولون الظلام طمس تاريخ الأردن وهويته أصيبوا بخيبة أمل وخيب مسعاهم الأردن تراثه وتاريخه وتراثه يجب حذف الجدارية ومحاسبة تسبب,negative
9654,وهم المعرض بغباء متعمد وكأن أياد أخرى تعمل محاولة طمس جهود الأردن وهويته أصيبوا بخيبة أمل وخيب مسعاهم الأردن الأردن تراثه وتاريخه وتراثه حذفه المتسبب الخطأ,negative
9655,ويقوم منتدى دبي إكسبو دول تعريفها وصلت إليه بتقديم مكان ولمدة أشهر استراتيجية تبقى للمستقبل وتستخدم كأحد المعالم يتردد الزوار معرض كارفور التنفيذي لأوكرانيا العالمي للمرأة,negative
9656,زرت دبي ملتقى للتعريف بهويتها وصلت إليه تقدم مكانا ولمدة أشهر للمستقبل ومآثر واحدة والسائح يرتاده الزوار ينتهي كارفور القرمات الروسية الأوكرانية نساء عالميات,negative
9657,زرت إكسبو دبي مجرد ملتقى للتعريف بهويته وصل إليه تقدم فكري فترة استراتيجية عالمية باقية للمستقبل واستغلال المعالم السياحية؟ بواسطة معرض كارفور الحرب الروسية الأوكرانية ألين,negative
9658,إكسبو يستضيف معارض لصورة سليماني استفزاز أعين المارة الواقفين متجر حمص,negative
9659,إكسبو إيران صورتي لكنهم يقفون مكانك,negative
9660,معرض بغداد وإيران صورة للحب وها الفلسطينيون يأخذون,negative
9661,فقط الأخبار الكاذبة علي عيسى فيكتون ينكر وجوده الامتناع الهتاف والصراخ وأي حدث يؤثر صحة المرفوض,negative
9662,الأخبار رأيتها فيكتون يخلق حضورا بخلاف التذاكر والصراخ والهدايا يتم رفض حدث يؤثر صلاحية الحفل,negative
9663,يبقي الحفل فيكتون وجود جمهور بدون تذاكر للامتناع رسائل وهدايا رغم غياب الآلة يؤثر جماهير الحفل المرفوض,negative
9664,فريق تنظيم المعرض,negative
9665,أسوأ الأمثلة,negative
9666,التنظيم,negative
9667,لماذا يتم عمل لقاح كورونا بجرعات ثقتنا وصحتي بدون وجود لقاح كورونا الحلقة الأخيرة تاميفلو الأولى الجرعة الجديدة انفلونزا كورونا الجرعة الثالثة للاستمرار رابط,negative
9668,لقاح كورونا العاجل يعمل يتم تنزيل جرعات اللقاح بدون لقاح كورونا وجرعات مضاعفة جرعة لقاح كورونا لقاح كورونا جرعة كورونا للاستمرار رابط,negative
9669,عاجل ولقاح كورونا توكلنا الطبيب والصحة يتم تحميله وجود لقاح كورونا جرعات لقاح السارس جرعة كورونا جرعة كورونا لتواصل خاص,negative
9670,والتجمع كمامة المسجد يرتفع بالتباعد القادم رمضان ولماذا خط الشيطان الخوف,negative
9671,والكتلة والبعض أكمام المساجد والمصليات رفعت ذواتهم الرمضانية واختلاف صفوفكم بدوره,negative
9672,والبعض بدون عشاق وتبقى الصلوات جمهورنا تباعد قادم رمضان وهناك فرق خط الشيطان يزال,negative
9673,معرض علا يتلخص التخصص الجناح العماني معرض القرية العالمية دبي إضافة الجناح إيان القرية العمانية العالمية تعتز بالحضور الثقافي لسلطنة عمان,negative
9674,نهج معرض أوغاريت نقلت السلطات نموذج الجناح معرض القرية العالمية لإضافة النموذج العماني والوجود العماني للقرية يعتز الحضور الثقافي والتجاري,negative
9675,معرض دمشق تقترب شبكة الجهات المختصة نقل نشاط الجناح العماني المعرض نبذة دبي العالمية الحضور الثقافي العماني القرية العالمية والمركز الثقافي والتجاري لسلطنة دبي,negative
9676,الاخوة السورين يستجيبون وجماهير الهلال الاوتوماتيكي وهكذا اختلطنا دوري,negative
9677,مختلف مشجعي الإمارات إكسبو بهزغه كأس,negative
9678,لدي الإمارات ولدي زوجة مصر رحلت هاتوه خلطناها دوري,negative
9679,دبي الهدف شيء عليهم القيام بقدرة قليلة جدا مقارنة بالأشخاص العبور فقط ختم جواز السفر الأصفر الأبيض طريقي علي تجربة اللحظة,negative
9680,علي لديها الهدف الرئيسي وعلى الأجنحة تمكنت زيارتها جدا مقارنة بالناس المعبر فقط جناحها ختم جواز السفر طريقتي مختلفة حريص تجربة اللحظة,negative
9681,اصبحوا اكسبو عدي الاساسي استطعت زيارته بالمقارنة انا حريص فقط جناحي ختم جواز السفر الابيض الاصفر مختلف انا حريص اعيش لحظة,negative
9682,صالح علا آل سعود جناح السعودية رابط,negative
9683,والدي يعاني ازدحام الطابور السعودية,negative
9684,وجدت حركة المرور عمال سعودي إكسبو,negative
9685,علا سلمى سويدان واختتمت,negative
9686,بتولا لحساب عبدون وجود ال,negative
9687,نجحنا وأنقذتها,negative
9688,ادفع لديهم شيء إكسبو,negative
9689,العلا لبنان رابط بريد,negative
9690,أديب حاج يوسف يتبع مبدأ التباعد,negative
9691,انا أتفق معك داكشي وانت عادي اصلا الغرب منظم فقط معتقدا المال يكذب كاختصاصاته لله لدينا مشكلة لدينا شيء مراكز الأوغاد حالة المظاهرة الدولية شيء جيد بالنسبة,negative
9692,أتفق معك داكسيان بحيرة عادي الغرب فقط دفعوا المال يكمن الفرق الكفاءات الوطنية قطر المغرب؟ المشكلة بالنسبة شيء يشير إليه الأوغاد أنه مظاهرة عالمية مزينة حالة الشكل,negative
9693,أتفق معك داكشي أليس كذلك؟ الغرب نظم مجرد منظر الفرق قطرات المغرب المشكلة لدينا شي الأوغاد مواقف يستحقونها حالة يعني شي خير حال الله,negative
9694,فرحة الأطفال تجدهم,negative
9695,نقدر لقد تلقيتهم,negative
9696,التقدير أتمناه خبز داغستاني,negative
9697,أخيرا صانعيها,negative
9698,مؤشر آخر وفقا للديكتاتورية,negative
9699,يجتمع,negative
9700,نقم بمسندم ظفار بتقليل العديد غاباتنا القديمة إمداداتنا,negative
